
          -------------------------------------------------------
          Amber 20 PMEMD                              2020
          -------------------------------------------------------

| PMEMD implementation of SANDER, Release 18

|  Compiled date/time: Mon Apr 27 21:19:54 2020
| Run on 09/29/2020 at 22:21:45

|   Executable path: /opt/software/Amber/20-fosscuda-2019b/amber20/bin/pmemd.cuda
| Working directory: /mnt/ls15/scratch/users/songlin3/run/solvation_amber20/acetate/two_steps_tip3p/step2_vdw_to_dummy/0.31608
|          Hostname: lac-344

  [-O]verwriting output

File Assignments:
|   MDIN: min.in                                                                
|  MDOUT: min.out                                                               
| INPCRD: step2_final.inpcrd                                                    
|   PARM: step2_final.prmtop                                                    
| RESTRT: min.rst                                                               
|   REFC: step2_final.inpcrd                                                    
|  MDVEL: mdvel                                                                 
|   MDEN: mden                                                                  
|  MDCRD: min.netcdf                                                            
| MDINFO: min.mdinfo                                                            
|  MDFRC: mdfrc                                                                 


 Here is the input file:

minimization                                                                   
 &cntrl                                                                        
  imin=1,                                                                      
  ntmin=2,                                                                     
  maxcyc=20000,                                                                
  cut=10.0,                                                                    
  ntc=1,                                                                       
  ntf=1,                                                                       
  ntb=1,                                                                       
  ntpr=5000,                                                                   
  ntwr=5000,                                                                   
  ntwx=2000,                                                                   
  ioutfm=1,                                                                    
  iwrap=0,                                                                     
  ifsc = 1, icfe=1,                                                            
  clambda=0.31608,                                                             
  timask1=':1', scmask1=':1', scmask2=':2',                                    
  timask2=':2', crgmask = ':1',                                                
/                                                                              


Note: ig = -1. Setting random seed to   420037 based on wallclock time in 
      microseconds.
| irandom = 1, using AMBER's internal random number generator (default).
 
|--------------------- INFORMATION ----------------------
| GPU (CUDA) Version of PMEMD in use: NVIDIA GPU IN USE.
|                    Version 18.0.0
| 
|                      03/25/2018
| 
| Implementation by:
|                    Ross C. Walker     (SDSC)
|                    Scott Le Grand     (nVIDIA)
| 
| Version 18 performance extensions by:
|                    David Cerutti     (Rutgers)
| 
| Precision model in use:
|      [SPFP] - Single Precision Forces, 64-bit Fixed Point
|               Accumulation. (Default)
| 
|--------------------------------------------------------
 
|----------------- CITATION INFORMATION -----------------
|
|    When publishing work that utilized the CUDA version
|    of AMBER, please cite the following in addition to
|    the regular AMBER citations:
|
|  - Romelia Salomon-Ferrer; Andreas W. Goetz; Duncan
|    Poole; Scott Le Grand; Ross C. Walker "Routine
|    microsecond molecular dynamics simulations with
|    AMBER - Part II: Particle Mesh Ewald", J. Chem.
|    Theory Comput., 2013, 9 (9), pp3878-3888,
|    DOI: 10.1021/ct400314y.
|
|  - Andreas W. Goetz; Mark J. Williamson; Dong Xu;
|    Duncan Poole; Scott Le Grand; Ross C. Walker
|    "Routine microsecond molecular dynamics simulations
|    with AMBER - Part I: Generalized Born", J. Chem.
|    Theory Comput., 2012, 8 (5), pp1542-1555.
|
|  - Scott Le Grand; Andreas W. Goetz; Ross C. Walker
|    "SPFP: Speed without compromise - a mixed precision
|    model for GPU accelerated molecular dynamics
|    simulations.", Comp. Phys. Comm., 2013, 184
|    pp374-380, DOI: 10.1016/j.cpc.2012.09.022
|
|    When publishing work that utilized the CUDA version
|    of TI, BAR, MBAR or FEP please cite the following 
|    publications in addition to the regular AMBER 
|    GPU citations:
|
|  - Daniel J. Mermelstein; Charles Lin; Gard Nelson; 
|    Rachael Kretsch; J. Andrew McCammon; Ross C. Walker
|    "Fast and Flexible GPU Accelerated Binding 
|    Free Energy Calculations within the AMBER Molecular
|    Dynamics Package" J. Comp. Chem., 2018,
|    DOI: 10.1002/jcc.25187
|
|  - Tai-Sung Lee; Yuan Hu; Brad Sherborne; Zhuyan Guo;
|    Darrin M. York
|    "Toward Fast and Accurate Binding Affinity Prediction with
|    pmemdGTI: An Efficient Implementation of GPU-Accelerated
|    Thermodynamic Integration"
|    J. Chem. Theory Comput., 2017, 13 (7), 3077
|
|
|--------------------------------------------------------
 
|------------------- GPU DEVICE INFO --------------------
|
|            CUDA_VISIBLE_DEVICES: 0
|   CUDA Capable Devices Detected:      1
|           CUDA Device ID in use:      0
|                CUDA Device Name: Tesla K80
|     CUDA Device Global Mem Size:  12206 MB
| CUDA Device Num Multiprocessors:     13
|           CUDA Device Core Freq:   0.82 GHz
|
|--------------------------------------------------------
 
 
| Conditional Compilation Defines Used:
| FFTW_FFT
| BINTRAJ
| MKL
| CUDA
| EMIL

| Largest sphere to fit in unit cell has radius =    27.333

| New format PARM file being parsed.
| Version =    1.000 Date = 09/14/20 Time = 13:47:03

| Note: 1-4 EEL scale factors are being read from the topology file.

| Note: 1-4 VDW scale factors are being read from the topology file.
| Duplicated    0 dihedrals

| Duplicated    0 dihedrals

--------------------------------------------------------------------------------
   1.  RESOURCE   USE: 
--------------------------------------------------------------------------------

 getting new box info from bottom of inpcrd
 NATOM  =   20855 NTYPES =      10 NBONH =   20847 MBONA  =       6
 NTHETH =      12 MTHETA =       6 NPHIH =      24 MPHIA  =       2
 NHPARM =       0 NPARM  =       0 NNB   =   27832 NRES   =    6949
 NBONA  =       6 NTHETA =       6 NPHIA =       2 NUMBND =       5
 NUMANG =       4 NPTRA  =       3 NATYP =       6 NPHB   =       1
 IFBOX  =       2 NMXRS  =       7 IFCAP =       0 NEXTRA =       0
 NCOPY  =       0

| Coordinate Index Table dimensions:    10   10   10
| Direct force subcell size =     6.6953    6.6953    6.6953

     BOX TYPE: TRUNCATED OCTAHEDRON

--------------------------------------------------------------------------------
   2.  CONTROL  DATA  FOR  THE  RUN
--------------------------------------------------------------------------------

default_name                                                                    

General flags:
     imin    =       1, nmropt  =       0

Nature and format of input:
     ntx     =       1, irest   =       0, ntrx    =       1

Nature and format of output:
     ntxo    =       2, ntpr    =    5000, ntrx    =       1, ntwr    =    5000
     iwrap   =       0, ntwx    =    2000, ntwv    =       0, ntwe    =       0
     ioutfm  =       1, ntwprt  =       0, idecomp =       0, rbornstat=      0

Potential function:
     ntf     =       1, ntb     =       1, igb     =       0, nsnb    =      25
     ipol    =       0, gbsa    =       0, iesp    =       0
     dielc   =   1.00000, cut     =  10.00000, intdiel =   1.00000

Frozen or restrained atoms:
     ibelly  =       0, ntr     =       0

Energy minimization:
     maxcyc  =   20000, ncyc    =      10, ntmin   =       2
     dx0     =   0.01000, drms    =   0.00010

Free energy options:
     icfe    =       1, ifsc    =       1, klambda =       1
     clambda =  0.3161, scalpha =  0.5000, scbeta  = 12.0000
     sceeorder =       2
     dynlmb =  0.0000 logdvdl =       0

| Intermolecular bonds treatment:
|     no_intermolecular_bonds =       1

| Energy averages sample interval:
|     ene_avg_sampling =       1

Ewald parameters:
     verbose =       0, ew_type =       0, nbflag  =       1, use_pme =       1
     vdwmeth =       1, eedmeth =       1, netfrc  =       0
     Box X =   66.953   Box Y =   66.953   Box Z =   66.953
     Alpha =  109.471   Beta  =  109.471   Gamma =  109.471
     NFFT1 =   64       NFFT2 =   64       NFFT3 =   64
     Cutoff=   10.000   Tol   =0.100E-04
     Ewald Coefficient =  0.27511
     Interpolation order =    4
     TI Mask 1 :1; matches      7 atoms
     TI Mask 2 :2; matches      7 atoms
     TI region 1:   20848 atoms
     TI region 2:   20848 atoms
     SC Mask 1 :1; matches      7 atoms
     SC Mask 2 :2; matches      7 atoms
Removing charge of      -0.8188 from atom       1
Removing charge of      -0.8188 from atom       2
Removing charge of       0.8054 from atom       3
Removing charge of      -0.1021 from atom       4
Removing charge of      -0.0219 from atom       5
Removing charge of      -0.0219 from atom       6
Removing charge of      -0.0219 from atom       7
Total charge of  -0.99999900 removed from       7 atoms
    No charge on TI atoms. Skipping extra recip sum.

--------------------------------------------------------------------------------
   3.  ATOMIC COORDINATES AND VELOCITIES
--------------------------------------------------------------------------------

                                                                                
 begin time read from input coords =     0.000 ps

 
 Number of triangulated 3-point waters found:     6947
 Number of shake restraints removed in TI region  1 :        0
 Number of shake restraints removed in TI region  2 :        0

     Sum of charges for TI region  1 =   0.00000000
     Skip neutralizing charges...


     Sum of charges for TI region  2 =   0.00000000
     Skip neutralizing charges...

| Dynamic Memory, Types Used:
| Reals              852901
| Integers           793201

| Nonbonded Pairs Initial Allocation:     6308116

| GPU memory information (estimate):
| KB of GPU memory in use:    182678
| KB of CPU memory in use:     50966

--------------------------------------------------------------------------------
   4.  RESULTS
--------------------------------------------------------------------------------


| TI region  1



   NSTEP       ENERGY          RMS            GMAX         NAME    NUMBER
      1      -5.2609E+04     5.5361E+01     1.4855E+03     O       16794

 BOND    =        0.3352  ANGLE   =        0.0000  DIHED      =       -0.0000
 VDWAALS =    17635.6484  EEL     =   -70244.5788  HBOND      =        0.0000
 1-4 VDW =        0.0000  1-4 EEL =        0.0000  RESTRAINT  =        0.0000
 DV/DL  =         6.2121
  Softcore part of the system:       7 atoms,       TEMP(K)    =           0.00
 SC_Etot=         0.0000  SC_EKtot=         0.0000  SC_EPtot   =        21.0919
 SC_BOND=        11.0985  SC_ANGLE=         4.5803  SC_DIHED   =         5.2200
 SC_14NB=         0.1931  SC_14EEL=         0.0000  SC_VDW     =         0.0000
 SC_EEL =         0.0000
 SC_RES_DIST=     0.0000  SC_RES_ANG=       0.0000  SC_RES_TORS=         0.0000
 SC_EEL_DER=      0.0000  SC_VDW_DER=       0.1673  SC_DERIV   =         0.1673
 ------------------------------------------------------------------------------


| TI region  2



   NSTEP       ENERGY          RMS            GMAX         NAME    NUMBER
      1      -5.2609E+04     5.5361E+01     1.4855E+03     O       16794

 BOND    =        0.3352  ANGLE   =        0.0000  DIHED      =       -0.0000
 VDWAALS =    17635.6484  EEL     =   -70244.5788  HBOND      =        0.0000
 1-4 VDW =        0.0000  1-4 EEL =        0.0000  RESTRAINT  =        0.0000
 DV/DL  =         6.2121
  Softcore part of the system:       7 atoms,       TEMP(K)    =           0.00
 SC_Etot=         0.0000  SC_EKtot=         0.0000  SC_EPtot   =        20.8988
 SC_BOND=        11.0985  SC_ANGLE=         4.5803  SC_DIHED   =         5.2200
 SC_14NB=         0.0000  SC_14EEL=         0.0000  SC_VDW     =         0.0000
 SC_EEL =         0.0000
 SC_RES_DIST=     0.0000  SC_RES_ANG=       0.0000  SC_RES_TORS=         0.0000
 SC_EEL_DER=      0.0000  SC_VDW_DER=       0.1673  SC_DERIV   =         0.1673
 ------------------------------------------------------------------------------


| TI region  1



   NSTEP       ENERGY          RMS            GMAX         NAME    NUMBER
   5000      -8.6714E+04     1.0771E-01     1.5219E+00     H1      12676

 BOND    =     6666.3503  ANGLE   =        0.0000  DIHED      =       -0.0000
 VDWAALS =    17120.2138  EEL     =  -110500.5624  HBOND      =        0.0000
 1-4 VDW =        0.0000  1-4 EEL =        0.0000  RESTRAINT  =        0.0000
 DV/DL  =         4.7503
  Softcore part of the system:       7 atoms,       TEMP(K)    =           0.00
 SC_Etot=         0.0000  SC_EKtot=         0.0000  SC_EPtot   =         8.3325
 SC_BOND=         0.0121  SC_ANGLE=         2.7863  SC_DIHED   =         5.2200
 SC_14NB=         0.3141  SC_14EEL=         0.0000  SC_VDW     =         0.0000
 SC_EEL =         0.0000
 SC_RES_DIST=     0.0000  SC_RES_ANG=       0.0000  SC_RES_TORS=         0.0000
 SC_EEL_DER=      0.0000  SC_VDW_DER=       0.0940  SC_DERIV   =         0.0940
 ------------------------------------------------------------------------------


| TI region  2



   NSTEP       ENERGY          RMS            GMAX         NAME    NUMBER
   5000      -8.6714E+04     1.0771E-01     1.5219E+00     H1      12676

 BOND    =     6666.3503  ANGLE   =        0.0000  DIHED      =       -0.0000
 VDWAALS =    17120.2138  EEL     =  -110500.5624  HBOND      =        0.0000
 1-4 VDW =        0.0000  1-4 EEL =        0.0000  RESTRAINT  =        0.0000
 DV/DL  =         4.7503
  Softcore part of the system:       7 atoms,       TEMP(K)    =           0.00
 SC_Etot=         0.0000  SC_EKtot=         0.0000  SC_EPtot   =         7.9852
 SC_BOND=         0.0000  SC_ANGLE=         2.7652  SC_DIHED   =         5.2200
 SC_14NB=         0.0000  SC_14EEL=         0.0000  SC_VDW     =         0.0000
 SC_EEL =         0.0000
 SC_RES_DIST=     0.0000  SC_RES_ANG=       0.0000  SC_RES_TORS=         0.0000
 SC_EEL_DER=      0.0000  SC_VDW_DER=       0.0940  SC_DERIV   =         0.0940
 ------------------------------------------------------------------------------


| TI region  1



   NSTEP       ENERGY          RMS            GMAX         NAME    NUMBER
  10000      -8.7726E+04     6.8798E-02     1.4096E+00     H2      14954

 BOND    =     6896.2648  ANGLE   =        0.0000  DIHED      =        0.0000
 VDWAALS =    18039.2529  EEL     =  -112661.7287  HBOND      =        0.0000
 1-4 VDW =        0.0000  1-4 EEL =        0.0000  RESTRAINT  =        0.0000
 DV/DL  =         5.2778
  Softcore part of the system:       7 atoms,       TEMP(K)    =           0.00
 SC_Etot=         0.0000  SC_EKtot=         0.0000  SC_EPtot   =         8.3323
 SC_BOND=         0.0118  SC_ANGLE=         2.7856  SC_DIHED   =         5.2199
 SC_14NB=         0.3150  SC_14EEL=         0.0000  SC_VDW     =         0.0000
 SC_EEL =         0.0000
 SC_RES_DIST=     0.0000  SC_RES_ANG=       0.0000  SC_RES_TORS=         0.0000
 SC_EEL_DER=      0.0000  SC_VDW_DER=       0.1085  SC_DERIV   =         0.1085
 ------------------------------------------------------------------------------


| TI region  2



   NSTEP       ENERGY          RMS            GMAX         NAME    NUMBER
  10000      -8.7726E+04     6.8798E-02     1.4096E+00     H2      14954

 BOND    =     6896.2648  ANGLE   =        0.0000  DIHED      =        0.0000
 VDWAALS =    18039.2529  EEL     =  -112661.7287  HBOND      =        0.0000
 1-4 VDW =        0.0000  1-4 EEL =        0.0000  RESTRAINT  =        0.0000
 DV/DL  =         5.2778
  Softcore part of the system:       7 atoms,       TEMP(K)    =           0.00
 SC_Etot=         0.0000  SC_EKtot=         0.0000  SC_EPtot   =         7.9852
 SC_BOND=         0.0000  SC_ANGLE=         2.7652  SC_DIHED   =         5.2200
 SC_14NB=         0.0000  SC_14EEL=         0.0000  SC_VDW     =         0.0000
 SC_EEL =         0.0000
 SC_RES_DIST=     0.0000  SC_RES_ANG=       0.0000  SC_RES_TORS=         0.0000
 SC_EEL_DER=      0.0000  SC_VDW_DER=       0.1085  SC_DERIV   =         0.1085
 ------------------------------------------------------------------------------


| TI region  1



   NSTEP       ENERGY          RMS            GMAX         NAME    NUMBER
  15000      -8.8163E+04     3.7721E-02     1.3569E+00     H1       2743

 BOND    =     7011.7942  ANGLE   =        0.0000  DIHED      =       -0.0000
 VDWAALS =    18494.9233  EEL     =  -113669.2564  HBOND      =        0.0000
 1-4 VDW =        0.0000  1-4 EEL =        0.0000  RESTRAINT  =        0.0000
 DV/DL  =         6.2177
  Softcore part of the system:       7 atoms,       TEMP(K)    =           0.00
 SC_Etot=         0.0000  SC_EKtot=         0.0000  SC_EPtot   =         8.3312
 SC_BOND=         0.0115  SC_ANGLE=         2.7840  SC_DIHED   =         5.2189
 SC_14NB=         0.3168  SC_14EEL=         0.0000  SC_VDW     =         0.0000
 SC_EEL =         0.0000
 SC_RES_DIST=     0.0000  SC_RES_ANG=       0.0000  SC_RES_TORS=         0.0000
 SC_EEL_DER=      0.0000  SC_VDW_DER=       0.1094  SC_DERIV   =         0.1094
 ------------------------------------------------------------------------------


| TI region  2



   NSTEP       ENERGY          RMS            GMAX         NAME    NUMBER
  15000      -8.8163E+04     3.7721E-02     1.3569E+00     H1       2743

 BOND    =     7011.7942  ANGLE   =        0.0000  DIHED      =       -0.0000
 VDWAALS =    18494.9233  EEL     =  -113669.2564  HBOND      =        0.0000
 1-4 VDW =        0.0000  1-4 EEL =        0.0000  RESTRAINT  =        0.0000
 DV/DL  =         6.2177
  Softcore part of the system:       7 atoms,       TEMP(K)    =           0.00
 SC_Etot=         0.0000  SC_EKtot=         0.0000  SC_EPtot   =         7.9852
 SC_BOND=         0.0000  SC_ANGLE=         2.7652  SC_DIHED   =         5.2200
 SC_14NB=         0.0000  SC_14EEL=         0.0000  SC_VDW     =         0.0000
 SC_EEL =         0.0000
 SC_RES_DIST=     0.0000  SC_RES_ANG=       0.0000  SC_RES_TORS=         0.0000
 SC_EEL_DER=      0.0000  SC_VDW_DER=       0.1094  SC_DERIV   =         0.1094
 ------------------------------------------------------------------------------


| TI region  1



   NSTEP       ENERGY          RMS            GMAX         NAME    NUMBER
  20000      -8.8378E+04     5.8825E-02     1.8191E+00     H1       8014

 BOND    =     7072.9244  ANGLE   =        0.0000  DIHED      =       -0.0000
 VDWAALS =    18726.0555  EEL     =  -114176.9717  HBOND      =        0.0000
 1-4 VDW =        0.0000  1-4 EEL =        0.0000  RESTRAINT  =        0.0000
 DV/DL  =         6.4189
  Softcore part of the system:       7 atoms,       TEMP(K)    =           0.00
 SC_Etot=         0.0000  SC_EKtot=         0.0000  SC_EPtot   =         8.3315
 SC_BOND=         0.0113  SC_ANGLE=         2.7858  SC_DIHED   =         5.2183
 SC_14NB=         0.3161  SC_14EEL=         0.0000  SC_VDW     =         0.0000
 SC_EEL =         0.0000
 SC_RES_DIST=     0.0000  SC_RES_ANG=       0.0000  SC_RES_TORS=         0.0000
 SC_EEL_DER=      0.0000  SC_VDW_DER=      -0.0444  SC_DERIV   =        -0.0444
 ------------------------------------------------------------------------------


| TI region  2



   NSTEP       ENERGY          RMS            GMAX         NAME    NUMBER
  20000      -8.8378E+04     5.8825E-02     1.8191E+00     H1       8014

 BOND    =     7072.9244  ANGLE   =        0.0000  DIHED      =       -0.0000
 VDWAALS =    18726.0555  EEL     =  -114176.9717  HBOND      =        0.0000
 1-4 VDW =        0.0000  1-4 EEL =        0.0000  RESTRAINT  =        0.0000
 DV/DL  =         6.4189
  Softcore part of the system:       7 atoms,       TEMP(K)    =           0.00
 SC_Etot=         0.0000  SC_EKtot=         0.0000  SC_EPtot   =         7.9852
 SC_BOND=         0.0000  SC_ANGLE=         2.7652  SC_DIHED   =         5.2200
 SC_14NB=         0.0000  SC_14EEL=         0.0000  SC_VDW     =         0.0000
 SC_EEL =         0.0000
 SC_RES_DIST=     0.0000  SC_RES_ANG=       0.0000  SC_RES_TORS=         0.0000
 SC_EEL_DER=      0.0000  SC_VDW_DER=      -0.0444  SC_DERIV   =        -0.0444
 ------------------------------------------------------------------------------



  Maximum number of minimization cycles reached.


                    FINAL RESULTS


| TI region  1



   NSTEP       ENERGY          RMS            GMAX         NAME    NUMBER
  20000      -8.8378E+04     5.8825E-02     1.8191E+00     H1       8014

 BOND    =     7072.9244  ANGLE   =        0.0000  DIHED      =       -0.0000
 VDWAALS =    18726.0555  EEL     =  -114176.9717  HBOND      =        0.0000
 1-4 VDW =        0.0000  1-4 EEL =        0.0000  RESTRAINT  =        0.0000
 DV/DL  =         6.4189
  Softcore part of the system:       7 atoms,       TEMP(K)    =           0.00
 SC_Etot=         0.0000  SC_EKtot=         0.0000  SC_EPtot   =         8.3315
 SC_BOND=         0.0113  SC_ANGLE=         2.7858  SC_DIHED   =         5.2183
 SC_14NB=         0.3161  SC_14EEL=         0.0000  SC_VDW     =         0.0000
 SC_EEL =         0.0000
 SC_RES_DIST=     0.0000  SC_RES_ANG=       0.0000  SC_RES_TORS=         0.0000
 SC_EEL_DER=      0.0000  SC_VDW_DER=      -0.0444  SC_DERIV   =        -0.0444
 ------------------------------------------------------------------------------


| TI region  2



   NSTEP       ENERGY          RMS            GMAX         NAME    NUMBER
  20000      -8.8378E+04     5.8825E-02     1.8191E+00     H1       8014

 BOND    =     7072.9244  ANGLE   =        0.0000  DIHED      =       -0.0000
 VDWAALS =    18726.0555  EEL     =  -114176.9717  HBOND      =        0.0000
 1-4 VDW =        0.0000  1-4 EEL =        0.0000  RESTRAINT  =        0.0000
 DV/DL  =         6.4189
  Softcore part of the system:       7 atoms,       TEMP(K)    =           0.00
 SC_Etot=         0.0000  SC_EKtot=         0.0000  SC_EPtot   =         7.9852
 SC_BOND=         0.0000  SC_ANGLE=         2.7652  SC_DIHED   =         5.2200
 SC_14NB=         0.0000  SC_14EEL=         0.0000  SC_VDW     =         0.0000
 SC_EEL =         0.0000
 SC_RES_DIST=     0.0000  SC_RES_ANG=       0.0000  SC_RES_TORS=         0.0000
 SC_EEL_DER=      0.0000  SC_VDW_DER=      -0.0444  SC_DERIV   =        -0.0444
 ------------------------------------------------------------------------------

--------------------------------------------------------------------------------
   5.  TIMINGS
--------------------------------------------------------------------------------

|  NonSetup CPU Time in Major Routines:
|
|     Routine           Sec        %
|     ------------------------------
|     Nonbond          46.08   71.37
|     Bond              0.00    0.00
|     Angle             0.00    0.00
|     Dihedral          0.00    0.00
|     Shake             0.00    0.00
|     Other            18.49   28.63
|     ------------------------------
|     Total            64.56

|  PME Nonbond Pairlist CPU Time:
|
|     Routine              Sec        %
|     ---------------------------------
|     Set Up Cit           0.00    0.00
|     Build List           0.00    0.00
|     ---------------------------------
|     Total                0.00    0.00

|  PME Direct Force CPU Time:
|
|     Routine              Sec        %
|     ---------------------------------
|     NonBonded Calc       0.00    0.00
|     Exclude Masked       0.00    0.00
|     Other                0.06    0.09
|     ---------------------------------
|     Total                0.06    0.09

|  PME Reciprocal Force CPU Time:
|
|     Routine              Sec        %
|     ---------------------------------
|     1D bspline           0.00    0.00
|     Grid Charges         0.00    0.00
|     Scalar Sum           0.00    0.00
|     Gradient Sum         0.00    0.00
|     FFT                  0.00    0.00
|     ---------------------------------
|     Total                0.00    0.00

|  Setup CPU time:            0.69 seconds
|  NonSetup CPU time:        64.56 seconds
|  Total CPU time:           65.26 seconds     0.02 hours

|  Setup wall time:           1    seconds
|  NonSetup wall time:       65    seconds
|  Total wall time:          66    seconds     0.02 hours
