
          -------------------------------------------------------
          Amber 20 PMEMD                              2020
          -------------------------------------------------------

| PMEMD implementation of SANDER, Release 18

|  Compiled date/time: Mon Apr 27 21:19:54 2020
| Run on 09/29/2020 at 22:17:29

|   Executable path: /opt/software/Amber/20-fosscuda-2019b/amber20/bin/pmemd.cuda
| Working directory: /mnt/ls15/scratch/users/songlin3/run/solvation_amber20/acetate/one_step_tip3p/acetate_to_nothing/0.99078
|          Hostname: lac-142

  [-O]verwriting output

File Assignments:
|   MDIN: min.in                                                                
|  MDOUT: min.out                                                               
| INPCRD: step1.inpcrd                                                          
|   PARM: step1.prmtop                                                          
| RESTRT: min.rst                                                               
|   REFC: step1.inpcrd                                                          
|  MDVEL: mdvel                                                                 
|   MDEN: mden                                                                  
|  MDCRD: min.netcdf                                                            
| MDINFO: min.mdinfo                                                            
|  MDFRC: mdfrc                                                                 


 Here is the input file:

minimization                                                                   
 &cntrl                                                                        
  imin=1,                                                                      
  ntmin=2,                                                                     
  maxcyc=20000,                                                                
  cut=10.0,                                                                    
  ntc=1,                                                                       
  ntf=1,                                                                       
  ntb=1,                                                                       
  ntpr=5000,                                                                   
  ntwr=5000,                                                                   
  ntwx=2000,                                                                   
  ioutfm=1,                                                                    
  iwrap=0,                                                                     
  ifsc = 1, icfe=1,                                                            
  clambda=0.99078,                                                             
  timask1=':1', scmask1=':1', scmask2='',                                      
  timask2='',                                                                  
/                                                                              


Note: ig = -1. Setting random seed to   361020 based on wallclock time in 
      microseconds.
| irandom = 1, using AMBER's internal random number generator (default).
 
|--------------------- INFORMATION ----------------------
| GPU (CUDA) Version of PMEMD in use: NVIDIA GPU IN USE.
|                    Version 18.0.0
| 
|                      03/25/2018
| 
| Implementation by:
|                    Ross C. Walker     (SDSC)
|                    Scott Le Grand     (nVIDIA)
| 
| Version 18 performance extensions by:
|                    David Cerutti     (Rutgers)
| 
| Precision model in use:
|      [SPFP] - Single Precision Forces, 64-bit Fixed Point
|               Accumulation. (Default)
| 
|--------------------------------------------------------
 
|----------------- CITATION INFORMATION -----------------
|
|    When publishing work that utilized the CUDA version
|    of AMBER, please cite the following in addition to
|    the regular AMBER citations:
|
|  - Romelia Salomon-Ferrer; Andreas W. Goetz; Duncan
|    Poole; Scott Le Grand; Ross C. Walker "Routine
|    microsecond molecular dynamics simulations with
|    AMBER - Part II: Particle Mesh Ewald", J. Chem.
|    Theory Comput., 2013, 9 (9), pp3878-3888,
|    DOI: 10.1021/ct400314y.
|
|  - Andreas W. Goetz; Mark J. Williamson; Dong Xu;
|    Duncan Poole; Scott Le Grand; Ross C. Walker
|    "Routine microsecond molecular dynamics simulations
|    with AMBER - Part I: Generalized Born", J. Chem.
|    Theory Comput., 2012, 8 (5), pp1542-1555.
|
|  - Scott Le Grand; Andreas W. Goetz; Ross C. Walker
|    "SPFP: Speed without compromise - a mixed precision
|    model for GPU accelerated molecular dynamics
|    simulations.", Comp. Phys. Comm., 2013, 184
|    pp374-380, DOI: 10.1016/j.cpc.2012.09.022
|
|    When publishing work that utilized the CUDA version
|    of TI, BAR, MBAR or FEP please cite the following 
|    publications in addition to the regular AMBER 
|    GPU citations:
|
|  - Daniel J. Mermelstein; Charles Lin; Gard Nelson; 
|    Rachael Kretsch; J. Andrew McCammon; Ross C. Walker
|    "Fast and Flexible GPU Accelerated Binding 
|    Free Energy Calculations within the AMBER Molecular
|    Dynamics Package" J. Comp. Chem., 2018,
|    DOI: 10.1002/jcc.25187
|
|  - Tai-Sung Lee; Yuan Hu; Brad Sherborne; Zhuyan Guo;
|    Darrin M. York
|    "Toward Fast and Accurate Binding Affinity Prediction with
|    pmemdGTI: An Efficient Implementation of GPU-Accelerated
|    Thermodynamic Integration"
|    J. Chem. Theory Comput., 2017, 13 (7), 3077
|
|
|--------------------------------------------------------
 
|------------------- GPU DEVICE INFO --------------------
|
|            CUDA_VISIBLE_DEVICES: 0
|   CUDA Capable Devices Detected:      1
|           CUDA Device ID in use:      0
|                CUDA Device Name: Tesla K80
|     CUDA Device Global Mem Size:  11441 MB
| CUDA Device Num Multiprocessors:     13
|           CUDA Device Core Freq:   0.82 GHz
|
|--------------------------------------------------------
 
 
| Conditional Compilation Defines Used:
| FFTW_FFT
| BINTRAJ
| MKL
| CUDA
| EMIL

| Largest sphere to fit in unit cell has radius =    27.333

| New format PARM file being parsed.
| Version =    1.000 Date = 06/12/20 Time = 12:17:32

| Note: 1-4 EEL scale factors are being read from the topology file.

| Note: 1-4 VDW scale factors are being read from the topology file.
| Duplicated    0 dihedrals

| Duplicated    0 dihedrals

--------------------------------------------------------------------------------
   1.  RESOURCE   USE: 
--------------------------------------------------------------------------------

 getting new box info from bottom of inpcrd
 NATOM  =   20848 NTYPES =       6 NBONH =   20844 MBONA  =       3
 NTHETH =       6 MTHETA =       3 NPHIH =      12 MPHIA  =       1
 NHPARM =       0 NPARM  =       0 NNB   =   27810 NRES   =    6948
 NBONA  =       3 NTHETA =       3 NPHIA =       1 NUMBND =       5
 NUMANG =       4 NPTRA  =       3 NATYP =       6 NPHB   =       1
 IFBOX  =       2 NMXRS  =       7 IFCAP =       0 NEXTRA =       0
 NCOPY  =       0

| Coordinate Index Table dimensions:    10   10   10
| Direct force subcell size =     6.6953    6.6953    6.6953

     BOX TYPE: TRUNCATED OCTAHEDRON

--------------------------------------------------------------------------------
   2.  CONTROL  DATA  FOR  THE  RUN
--------------------------------------------------------------------------------

default_name                                                                    

General flags:
     imin    =       1, nmropt  =       0

Nature and format of input:
     ntx     =       1, irest   =       0, ntrx    =       1

Nature and format of output:
     ntxo    =       2, ntpr    =    5000, ntrx    =       1, ntwr    =    5000
     iwrap   =       0, ntwx    =    2000, ntwv    =       0, ntwe    =       0
     ioutfm  =       1, ntwprt  =       0, idecomp =       0, rbornstat=      0

Potential function:
     ntf     =       1, ntb     =       1, igb     =       0, nsnb    =      25
     ipol    =       0, gbsa    =       0, iesp    =       0
     dielc   =   1.00000, cut     =  10.00000, intdiel =   1.00000

Frozen or restrained atoms:
     ibelly  =       0, ntr     =       0

Energy minimization:
     maxcyc  =   20000, ncyc    =      10, ntmin   =       2
     dx0     =   0.01000, drms    =   0.00010

Free energy options:
     icfe    =       1, ifsc    =       1, klambda =       1
     clambda =  0.9908, scalpha =  0.5000, scbeta  = 12.0000
     sceeorder =       2
     dynlmb =  0.0000 logdvdl =       0

| Intermolecular bonds treatment:
|     no_intermolecular_bonds =       1

| Energy averages sample interval:
|     ene_avg_sampling =       1

Ewald parameters:
     verbose =       0, ew_type =       0, nbflag  =       1, use_pme =       1
     vdwmeth =       1, eedmeth =       1, netfrc  =       0
     Box X =   66.953   Box Y =   66.953   Box Z =   66.953
     Alpha =  109.471   Beta  =  109.471   Gamma =  109.471
     NFFT1 =   64       NFFT2 =   64       NFFT3 =   64
     Cutoff=   10.000   Tol   =0.100E-04
     Ewald Coefficient =  0.27511
     Interpolation order =    4
     TI Mask 1 :1; matches      7 atoms
     TI Mask 2  matches      0 atoms
     TI region 1:   20848 atoms
     TI region 2:   20841 atoms
     SC Mask 1 :1; matches      7 atoms

--------------------------------------------------------------------------------
   3.  ATOMIC COORDINATES AND VELOCITIES
--------------------------------------------------------------------------------

default_name                                                                    
 begin time read from input coords =     0.000 ps

 
 Number of triangulated 3-point waters found:     6947
 Number of shake restraints removed in TI region  1 :        0
 Number of shake restraints removed in TI region  2 :        0

     Sum of charges for TI region  1 =  -0.99999900
     Skip neutralizing charges...


     Sum of charges for TI region  2 =   0.00000000
     Skip neutralizing charges...

| Dynamic Memory, Types Used:
| Reals              852433
| Integers           792569

| Nonbonded Pairs Initial Allocation:     6305998

| GPU memory information (estimate):
| KB of GPU memory in use:    182449
| KB of CPU memory in use:     50737

--------------------------------------------------------------------------------
   4.  RESULTS
--------------------------------------------------------------------------------


| TI region  1



   NSTEP       ENERGY          RMS            GMAX         NAME    NUMBER
      1      -5.2605E+04     5.5360E+01     1.4855E+03     O       16787

 BOND    =        0.3352  ANGLE   =        0.0000  DIHED      =       -0.0000
 VDWAALS =    17639.7283  EEL     =   -70244.6795  HBOND      =        0.0000
 1-4 VDW =        0.0000  1-4 EEL =       -0.0000  RESTRAINT  =        0.0000
 DV/DL  =        16.8294
  Softcore part of the system:       7 atoms,       TEMP(K)    =           0.00
 SC_Etot=         0.0000  SC_EKtot=         0.0000  SC_EPtot   =        31.3490
 SC_BOND=        11.0985  SC_ANGLE=         4.5803  SC_DIHED   =         5.2200
 SC_14NB=         0.1931  SC_14EEL=        10.2571  SC_VDW     =         0.0000
 SC_EEL =         0.0000
 SC_RES_DIST=     0.0000  SC_RES_ANG=       0.0000  SC_RES_TORS=         0.0000
 SC_EEL_DER=      0.0092  SC_VDW_DER=       0.0022  SC_DERIV   =         0.0114
 ------------------------------------------------------------------------------


| TI region  2



   NSTEP       ENERGY          RMS            GMAX         NAME    NUMBER
      1      -5.2605E+04     5.5360E+01     1.4855E+03     O       16787

 BOND    =        0.3352  ANGLE   =        0.0000  DIHED      =       -0.0000
 VDWAALS =    17639.7283  EEL     =   -70244.6795  HBOND      =        0.0000
 1-4 VDW =        0.0000  1-4 EEL =       -0.0000  RESTRAINT  =        0.0000
 DV/DL  =        16.8294

| TI region  1



   NSTEP       ENERGY          RMS            GMAX         NAME    NUMBER
   5000      -8.6715E+04     1.0083E-01     1.4824E+00     H1      12669

 BOND    =     6669.4063  ANGLE   =        0.0000  DIHED      =       -0.0000
 VDWAALS =    17128.5521  EEL     =  -110512.8710  HBOND      =        0.0000
 1-4 VDW =        0.0000  1-4 EEL =        0.0000  RESTRAINT  =        0.0000
 DV/DL  =        19.6471
  Softcore part of the system:       7 atoms,       TEMP(K)    =           0.00
 SC_Etot=         0.0000  SC_EKtot=         0.0000  SC_EPtot   =        18.7703
 SC_BOND=         0.0436  SC_ANGLE=         2.8176  SC_DIHED   =         5.2200
 SC_14NB=         0.2738  SC_14EEL=        10.4152  SC_VDW     =         0.0000
 SC_EEL =         0.0000
 SC_RES_DIST=     0.0000  SC_RES_ANG=       0.0000  SC_RES_TORS=         0.0000
 SC_EEL_DER=      0.0088  SC_VDW_DER=       0.0011  SC_DERIV   =         0.0098
 ------------------------------------------------------------------------------


| TI region  2



   NSTEP       ENERGY          RMS            GMAX         NAME    NUMBER
   5000      -8.6715E+04     1.0083E-01     1.4824E+00     H1      12669

 BOND    =     6669.4063  ANGLE   =        0.0000  DIHED      =       -0.0000
 VDWAALS =    17128.5521  EEL     =  -110512.8710  HBOND      =        0.0000
 1-4 VDW =        0.0000  1-4 EEL =        0.0000  RESTRAINT  =        0.0000
 DV/DL  =        19.6471

| TI region  1



   NSTEP       ENERGY          RMS            GMAX         NAME    NUMBER
  10000      -8.7722E+04     2.3465E-01     4.1027E+00     H1       8007

 BOND    =     6950.0606  ANGLE   =        0.0000  DIHED      =       -0.0000
 VDWAALS =    18046.3289  EEL     =  -112718.8289  HBOND      =        0.0000
 1-4 VDW =        0.0000  1-4 EEL =        0.0000  RESTRAINT  =        0.0000
 DV/DL  =        21.0320
  Softcore part of the system:       7 atoms,       TEMP(K)    =           0.00
 SC_Etot=         0.0000  SC_EKtot=         0.0000  SC_EPtot   =        18.7703
 SC_BOND=         0.0435  SC_ANGLE=         2.8176  SC_DIHED   =         5.2200
 SC_14NB=         0.2739  SC_14EEL=        10.4153  SC_VDW     =         0.0000
 SC_EEL =         0.0000
 SC_RES_DIST=     0.0000  SC_RES_ANG=       0.0000  SC_RES_TORS=         0.0000
 SC_EEL_DER=      0.0098  SC_VDW_DER=       0.0011  SC_DERIV   =         0.0109
 ------------------------------------------------------------------------------


| TI region  2



   NSTEP       ENERGY          RMS            GMAX         NAME    NUMBER
  10000      -8.7722E+04     2.3465E-01     4.1027E+00     H1       8007

 BOND    =     6950.0606  ANGLE   =        0.0000  DIHED      =       -0.0000
 VDWAALS =    18046.3289  EEL     =  -112718.8289  HBOND      =        0.0000
 1-4 VDW =        0.0000  1-4 EEL =        0.0000  RESTRAINT  =        0.0000
 DV/DL  =        21.0320

| TI region  1



   NSTEP       ENERGY          RMS            GMAX         NAME    NUMBER
  15000      -8.8159E+04     1.2342E-01     3.3049E+00     H1       8007

 BOND    =     7035.1256  ANGLE   =        0.0000  DIHED      =       -0.0000
 VDWAALS =    18500.4414  EEL     =  -113694.5368  HBOND      =        0.0000
 1-4 VDW =        0.0000  1-4 EEL =       -0.0000  RESTRAINT  =        0.0000
 DV/DL  =        20.6343
  Softcore part of the system:       7 atoms,       TEMP(K)    =           0.00
 SC_Etot=         0.0000  SC_EKtot=         0.0000  SC_EPtot   =        18.7703
 SC_BOND=         0.0435  SC_ANGLE=         2.8175  SC_DIHED   =         5.2200
 SC_14NB=         0.2739  SC_14EEL=        10.4153  SC_VDW     =         0.0000
 SC_EEL =         0.0000
 SC_RES_DIST=     0.0000  SC_RES_ANG=       0.0000  SC_RES_TORS=         0.0000
 SC_EEL_DER=      0.0105  SC_VDW_DER=       0.0012  SC_DERIV   =         0.0117
 ------------------------------------------------------------------------------


| TI region  2



   NSTEP       ENERGY          RMS            GMAX         NAME    NUMBER
  15000      -8.8159E+04     1.2342E-01     3.3049E+00     H1       8007

 BOND    =     7035.1256  ANGLE   =        0.0000  DIHED      =       -0.0000
 VDWAALS =    18500.4414  EEL     =  -113694.5368  HBOND      =        0.0000
 1-4 VDW =        0.0000  1-4 EEL =       -0.0000  RESTRAINT  =        0.0000
 DV/DL  =        20.6343

| TI region  1



   NSTEP       ENERGY          RMS            GMAX         NAME    NUMBER
  20000      -8.8374E+04     3.6750E-02     1.3336E+00     H2        259

 BOND    =     7069.7030  ANGLE   =        0.0000  DIHED      =        0.0000
 VDWAALS =    18733.0823  EEL     =  -114177.1780  HBOND      =        0.0000
 1-4 VDW =        0.0000  1-4 EEL =       -0.0000  RESTRAINT  =        0.0000
 DV/DL  =        20.1539
  Softcore part of the system:       7 atoms,       TEMP(K)    =           0.00
 SC_Etot=         0.0000  SC_EKtot=         0.0000  SC_EPtot   =        18.7703
 SC_BOND=         0.0435  SC_ANGLE=         2.8175  SC_DIHED   =         5.2200
 SC_14NB=         0.2740  SC_14EEL=        10.4153  SC_VDW     =         0.0000
 SC_EEL =         0.0000
 SC_RES_DIST=     0.0000  SC_RES_ANG=       0.0000  SC_RES_TORS=         0.0000
 SC_EEL_DER=      0.0115  SC_VDW_DER=       0.0012  SC_DERIV   =         0.0127
 ------------------------------------------------------------------------------


| TI region  2



   NSTEP       ENERGY          RMS            GMAX         NAME    NUMBER
  20000      -8.8374E+04     3.6750E-02     1.3336E+00     H2        259

 BOND    =     7069.7030  ANGLE   =        0.0000  DIHED      =        0.0000
 VDWAALS =    18733.0823  EEL     =  -114177.1780  HBOND      =        0.0000
 1-4 VDW =        0.0000  1-4 EEL =       -0.0000  RESTRAINT  =        0.0000
 DV/DL  =        20.1539


  Maximum number of minimization cycles reached.


                    FINAL RESULTS


| TI region  1



   NSTEP       ENERGY          RMS            GMAX         NAME    NUMBER
  20000      -8.8374E+04     3.6750E-02     1.3336E+00     H2        259

 BOND    =     7069.7030  ANGLE   =        0.0000  DIHED      =        0.0000
 VDWAALS =    18733.0823  EEL     =  -114177.1780  HBOND      =        0.0000
 1-4 VDW =        0.0000  1-4 EEL =       -0.0000  RESTRAINT  =        0.0000
 DV/DL  =        20.1539
  Softcore part of the system:       7 atoms,       TEMP(K)    =           0.00
 SC_Etot=         0.0000  SC_EKtot=         0.0000  SC_EPtot   =        18.7703
 SC_BOND=         0.0435  SC_ANGLE=         2.8175  SC_DIHED   =         5.2200
 SC_14NB=         0.2740  SC_14EEL=        10.4153  SC_VDW     =         0.0000
 SC_EEL =         0.0000
 SC_RES_DIST=     0.0000  SC_RES_ANG=       0.0000  SC_RES_TORS=         0.0000
 SC_EEL_DER=      0.0115  SC_VDW_DER=       0.0012  SC_DERIV   =         0.0127
 ------------------------------------------------------------------------------


| TI region  2



   NSTEP       ENERGY          RMS            GMAX         NAME    NUMBER
  20000      -8.8374E+04     3.6750E-02     1.3336E+00     H2        259

 BOND    =     7069.7030  ANGLE   =        0.0000  DIHED      =        0.0000
 VDWAALS =    18733.0823  EEL     =  -114177.1780  HBOND      =        0.0000
 1-4 VDW =        0.0000  1-4 EEL =       -0.0000  RESTRAINT  =        0.0000
 DV/DL  =        20.1539
--------------------------------------------------------------------------------
   5.  TIMINGS
--------------------------------------------------------------------------------

|  NonSetup CPU Time in Major Routines:
|
|     Routine           Sec        %
|     ------------------------------
|     Nonbond          46.78   70.37
|     Bond              0.00    0.00
|     Angle             0.00    0.00
|     Dihedral          0.00    0.00
|     Shake             0.00    0.00
|     Other            19.70   29.63
|     ------------------------------
|     Total            66.48

|  PME Nonbond Pairlist CPU Time:
|
|     Routine              Sec        %
|     ---------------------------------
|     Set Up Cit           0.00    0.00
|     Build List           0.00    0.00
|     ---------------------------------
|     Total                0.00    0.00

|  PME Direct Force CPU Time:
|
|     Routine              Sec        %
|     ---------------------------------
|     NonBonded Calc       0.00    0.00
|     Exclude Masked       0.00    0.00
|     Other                0.07    0.10
|     ---------------------------------
|     Total                0.07    0.10

|  PME Reciprocal Force CPU Time:
|
|     Routine              Sec        %
|     ---------------------------------
|     1D bspline           0.00    0.00
|     Grid Charges         0.00    0.00
|     Scalar Sum           0.00    0.00
|     Gradient Sum         0.00    0.00
|     FFT                  0.00    0.00
|     ---------------------------------
|     Total                0.00    0.00

|  Setup CPU time:            0.72 seconds
|  NonSetup CPU time:        66.48 seconds
|  Total CPU time:           67.20 seconds     0.02 hours

|  Setup wall time:           1    seconds
|  NonSetup wall time:       67    seconds
|  Total wall time:          68    seconds     0.02 hours
